side	opponent	round	number	attacks	ann	text
					0	(…) A conceptual and/or theoretical perspective is needed to shed light at the differences found.
Reviewer_2	Author	1	10	0	2	The authors should include a discussion on how these countries differ e.g.
					0	in terms of the role of the state versus private initiative, governance traditions and philosophies, centralist vs. federal set-up.
					0	(…) The varieties of capitalism (VoC) concept developed by HALL/SOSKICE (2011) may be a suitable concept here, as it has been applied to cluster policies in the U.S. and Germany by STERNBERG et al.
					0	(2010).
					0	Since Japan, France and Germany are all classified as co-ordinated market economies in the original VoC concept, more nuanced differentiations of capitalisms – or other institutional frameworks – might be recommended for the paper.
					0	*
Author	Reviewer_2	2	11	8	1	We recognized that we did not concretely explain the initial (we changed the term to “basic” in the revision) conditions of clusters in the previous version.
Author	Reviewer_2	2	11	8	1	Moreover, we recognize that it is important to discuss in detail how these countries differ regarding basic conditions and why the national cluster policies differ across them.
Author	Reviewer_2	2	11	8	1	Therefore, we fundamentally changed the structure of our manuscript and set up a new Section 3.1 to discuss these issues in detail.
Author	Reviewer_2	2	11	8	1	Here, we cited the suggested book chapter and paper, but mainly used statistical evidence from OECD Science, Technology and Industry Scoreboard on (different) innovation systems to characterize basic conditions of clusters and to distinguish between private- and public-driven clusters.
Author	Reviewer_2	2	11	8	1	We summarized the discussion in Table 1 (new).
					0	• The authors focus on what they call ‘intellectual clusters’, a term that appears 21 times throughout the paper although I cannot recall having ever seen it in a decade or so of studying clusters and cluster policies.
					0	According to the definition on the top of page 4, the term denotes a R9 cluster led by a public research organisation, which is rather specific and I doubt it applies to the six case studies outlined in the paper.
					0	Even so, the term ‘intellectual’ does not look fully appropriate here, which may be due to its translation from a Japanese original.
					0	‘Public research-led cluster’ might be more to the point, as it appears difficult to judge if these are more or less ‘intellectual’ than other forms of clusters.
					0	At the least, it would appear sound to qualify these six cases as science-based clusters, but then this would apply to the biotech industry and all its clusters in general.
					0	*
Author	Reviewer_2	2	12	11	1	Maybe “intellectual cluster” is a specific jargon in the Japanese policy.
Author	Reviewer_2	2	12	11	1	Following your suggestion, and according to the EU reports we cited in our manuscript, we deleted the adjective “intellectual” for clusters and just use “clusters”, because it does neither affect our concept nor findings.
					0	• Methodology: The choice of clusters is generally well explained on pp.
					0	2-3.
					0	When elaborating on the choice of nations, one might wonder why the United States have not been included – possibly because there is no comparable national cluster policy?!
					0	When explaining the choice of regional cases, the term ‘representative’ appears misleading.
					0	It seems that the most prominent or successful cases have been selected, at least for Germany and France.
					0	How can these be ‘representative’ for whatever population of biotech clusters in these countries?
					0	When outlining their research methodology, the authors should state precisely how many interviews they conducted.
					0	It looks as if one interview was done with the cluster manager in the six regions, but the authors also claim to have interviewed ‘the presidents of cluster firms’ (p. 8, line 20) without indicating the number.
					0	Given the conceptual framework outlined in figure 1, one might also wonder why national policymakers, i.e.
					0	representatives of the respective national cluster programs, have not been surveyed as well.
					0	Furthermore, some reflection on the adopted comparative case study research design with references would be desirable.
					0	*
Author	Reviewer_2	2	13	12	1	We did not include USA in the international comparison because, as you correctly suggested, there is no comparable national cluster policy there.
Author	Reviewer_2	2	13	12	1	However, we use USA in Table 1 on basic conditions as the baseline reference for the three countries.
					0	*
Author	Reviewer_2	2	14	12	1	We recognize that the term “representative” is misleading.
Author	Reviewer_2	2	14	12	1	We replaced it with “outstanding” in the revised manuscript.
					0	*
Author	Reviewer_2	2	15	13	1	We added detailed information about the number and types of interview partners and interview time on page 9 at the end of Section 2.3 (Research Methodology).
					0	*
Author	Reviewer_2	2	16	15	1	We did not interview the officers in charge of cluster policy in the government because information on national cluster policy was sufficiently available from cluster managers and second sources including ministry’s websites and because we are more interested in the relationship of cluster policy with basic conditions and local management than in the cluster policy itself.
					0	*
Author	Reviewer_2	2	17	15	1	With 3 references, we discussed in the (newly inserted) third paragraph of Section 2.3 the advantages of comparative case studies across countries focusing on biotechnology.
					0	R10 · Section 4: The presentation of the six case studies is very systematic and clear.
					0	However, sections 4.3 to 4.5 leave an impression that the assessment of these cases as ‘bottom-up’ is not completely justified.
					0	The authors seem to assume that cluster policies are either bottom-up or top-down, without any shades of grey in between.
					0	Compared to the Japanese cases, the French and German cases are clearly more bottom-up, but they still display clear – if not dominant – elements of top-down governance and public agency.
					0	This dichotomy should be refined and the classification of cases qualified as, e.g., ‘relatively bottom-up’.
					0	For the German cases, the authors may have underestimated public agency, since they did not investigate the role of state governments (Bavaria, Baden-Württemberg) within the country’s system of multilevel governance, which is key to understand cluster policies in Germany (cf.
					0	KIESE 2013).
					0	Furthermore, the state government of Bavaria may be a regional government, but it is certainly not a local authority (like the city of Munich; page 15, line 29) in Germany’s system of multilevel governance.
					0	*
Author	Reviewer_2	2	18	16	1	The classification between top-down and bottom-up clusters is misleading.
Author	Reviewer_2	2	18	16	1	In the conceptual framework we distinguish between public-driven and private-driven clusters, so that in the revised version we focused on this type of distinction and cut all descriptions on top-down and bottom-up clusters.
					0	*
Author	Reviewer_2	2	19	16	1	Referring to Kiese (2013) and Sternberg et al.
Author	Reviewer_2	2	19	16	1	(2010), but also other papers such as Crespy et al.
Author	Reviewer_2	2	19	16	1	(2007) for France, we added that, especially for Germany, we should not underestimate the roles of states and local authorities in the cluster policy.
Author	Reviewer_2	2	19	16	1	Finally, in the conclusion, we stressed the lack of multilevel governance approach as a limitation, which should be more explicitly considered in future research.
					0	• Section 5 does not include any reference and is purely descriptive and sometimes even superficial, lacking any comparison, explanation or assessment.
					0	This is probably the result of a rather weak empirical basis, provided it draws on interviews with a total of six cluster managers.
					0	Critical issues such as the cluster management organisation’s budget and finance have not been addressed.
					0	The relevance of the information presented here for the following discussion and conclusion remain far from clear.
					0	In my humble opinion, this is the weakest part of the paper that might well be omitted and replaced by a suitable conceptual frame for international comparison, as outlined above.
					0	*
Author	Reviewer_2	2	20	17	1	We recognized that this section has several problems, but only this section describes and compares local cluster management based on our own interviews, so that this is the core part of our manuscript.
Author	Reviewer_2	2	20	17	1	Therefore, we fundamentally changed this section in the following way.
Author	Reviewer_2	2	20	17	1	First, we have some reference in the revised version, whereas this section is mainly based on our interviews.
Author	Reviewer_2	2	20	17	1	Second, at the beginning of this section, we explained the relevance of this section in our concept, especially with regard to our (new) hypotheses. Third, more importantly, we reorganized this section to a comparison of cluster management across three countries, focusing on the selection procedure of joint R&D R11 projects (and cutting other information such as monitoring process and support programs). In this way, we made it clear what we do in this section: to check the consistency of local cluster management (regarding project selection) with the cluster’s basic conditions and the national policy. We believe that we could clarify the relevance of the content of this section with the preceding part and the conclusion of this manuscript.
					0	*
Author	Reviewer_2	2	21	17	1	Cluster Organization’s governance and financing, which was already described in another section in the previous version, is now explained even earlier, in Section 3.2.
					0	• As also elaborated above, the conclusion should go beyond a mere summary to include methodological reflection, implications for policy (learning), as well as a more extensive discussion of further research perspectives.
					0	*
Author	Reviewer_2	2	22	18	1	We cut the most part of the discussion in the conclusion (which was mostly redundant with the contents of preceding sections), and added policy implication and some limitations (lack of multilevel governance and dynamic perspectives, possible selection bias of target clusters, and the descriptive and qualitative nature of the study) combined with future research perspectives.
					0	Specific Comments • Page 3, line 3: The authors might want to link to the literature on differentiated knowledge bases, which assigns an analytical (science-based) knowledge base to the biotech industry (cf.
					0	ASHEIM ET AL. 2011).
					0	*
Author	Reviewer_2	2	23	19	1	We cited this paper in footnote 4 in page 3.
					0	• Page 4, line 23: ‘few studies’ – If you mean ‘few’, please state the references.
					0	If ‘few’ means ‘no’, then please say so straightaway.
					0	*
Author	Reviewer_2	2	24	20	1	We agree with the suggestion and changed “few” to “no”.
Author	Reviewer_2	2	24	20	1	We also checked all the other terms “few” in the manuscript and treated them in the suggested way.
					0	• Page 6, line 25: I would suggest softening the statement that matched funding ‘prevents moral hazard and crowding out’.
					0	It certainly helps preventing, partly prevents, or reduces the risk of these problems occurring.
					0	*
Author	Reviewer_2	2	25	21	1	We changed the sentence (now page 6, line 22) in the following way: “may enhance the incentives of member firms to succeed and partially prevent moral hazard and crowding out”.
					0	• Section 2 contains a number of “expectations”, which could be flagged out and numbered as hypotheses.
					0	Taking these up in the empirical discussion could help the reader’s orientation.
					0	*
Author	Reviewer_2	2	26	22	1	Based on the argument in Section 2.2, we presented three hypotheses in page 7, which are repeatedly addressed in later sections and the conclusion.
					0	R12 • Page 8, lines 1-2: This is interesting indeed.
					0	Is there comparable evidence on policy learning between Germany and France?
					0	Timing and content suggest that French national policies may well have been inspired by the German BioRegio contest.
					0	*
Author	Reviewer_2	2	27	23	1	We found no evidence on policy learning between Germany and France.
					0	• Page 10, line 19 – ‘several cluster policies’: I would address this family of related programmes as one policy rather than many.
					0	*
Author	Reviewer_2	2	28	24	1	We changed the phrase to “a series of national cluster policy” (now page 18, line 5) at the beginning of Section 4.2.
					0	• Page 10, line 28: The number of 85 applicants contains some clusters who applied more than once in the three rounds of the contest.
					0	*
Author	Reviewer_2	2	29	25	1	We noticed in footnote 18 in page 18 that some cluster regions may have applied for this program twice or three times after failing in the previous competition.
					0	• Section 3.3: There is a little bit of literature on French national cluster policy that deserves a brief review or at least reference here (e.g., BRETTE/CHAPPOZ 2007, DURANTON ET AL. 2010, LONGHI/ROCHHIA 2013).
					0	*
Author	Reviewer_2	2	30	26	1	We cited these studies in Introduction and in Section 4.3 (page 18, footnotes 20 and 21).
					0	• Page 12, lines 11-12: Table 2 provides a descriptive summary, but no ‘explanation’ – see major comments.
					0	*
Author	Reviewer_2	2	31	27	1	We cut the previous Table 2 (on each target cluster and cluster management) in the revision and also the related sentence.
					0	• Page 14, line 21: How can this be a cluster if there are ‘only a few biotech ventures’?
					0	If the aim of public policy is to grow a cluster around a research organisation or hospital, this does not seem to produce any meaningful outcomes as yet.
					0	*
Author	Reviewer_2	2	32	28	1	We agree with you.
Author	Reviewer_2	2	32	28	1	However, according to the MEXT’s definition, clusters need not involve local high-tech ventures.
Author	Reviewer_2	2	32	28	1	R&D collaboration between local public research institute and private firms outside of the cluster area is also an important part of a cluster for MEXT.
Author	Reviewer_2	2	32	28	1	Regarding the aim of local authorities, which includes the development of a cluster around a research organization or hospital, indeed cluster policy has not produced any outcomes yet.
					0	• Page 15, lines 22-23: ‘Large firms are on the whole not active in clusters’ – As a general statement, this is certainly not true.
					0	*
Author	Reviewer_2	2	35	31	1	We cut this sentence.
					0	• Page 15, line 24: Here and elsewhere, universities are attributed with the term ‘famous’.
					0	This should be backed up with evidence (data) and preferably rephrased, such as ‘recognised R13 research universities’, or ‘elite’ with reference to the German federal government’s programme of university excellence (Exzellenzinitiative).
					0	*
Author	Reviewer_2	2	34	30	1	We used “prominent” and “excellent” instead of “famous”.
					0	• Page 15, line 27: Repetition – the IZB incubator was already mentioned on line 9.
					0	* We cut this sentence.
					0	• Section 4.5: Unlike the regional cluster initiatives in Alsace and Baden, the trinational BioValley initiative has hardly had any impact in terms of intensifying cross-border interaction, confirming problems that KOSCHATZKY (2000) had identified long before.
					0	Indeed, many INTERREG projects fail to overcome the differences in national languages, legislations and cultures, even though the regions are neighbours.
					0	*
Author	Reviewer_2	2	36	32	1	We cited this paper in footnote 14 in Section 3.2.
Author	Reviewer_2	2	36	32	1	(3) to mention that Trinational BioValley has hardly had any impact in terms of intensifying cross-border interaction.
					0	• The layout of the tables may be improved, especially the spacing of the text.
					0	*
Author	Reviewer_2	2	37	33	1	We changed the layout of the tables enlarging the font.
					0	• The paper contains funding information in Yen and Euros.
					0	This should be harmonised, or preferably conversions given in brackets or footnotes for the reader’s convenience.
					0	*
Author	Reviewer_2	2	38	34	1	In the revision, we write the funding amount for Japan in Yen, but give the converged amount in Euro in parentheses.
Author	Reviewer_2	2	38	34	1	We use the most recent exchange rate for convenience, and explain it where it is first mentioned (note to Table 1 in page 16 and footnote 17 in page 17).
					0	2.
					0	Second Round of Evaluation Round 2:
Reviewer_1	Author	3	1	0	2	The paper now looks but I would encourage you to have a native speaker look at it, mainly to clarify the language in some places.
Reviewer_1	Author	3	2	0	2	Content-wise to me the key observation is the - potentially systematic - connection between the way cluster policies arestructure and the organization of cluster initiatives.
Reviewer_1	Author	3	2	0	2	This is not a big suprise, and it doesn't really answer the question asto which model is better (only that there are internally consistent models that are different).
Reviewer_1	Author	3	2	0	2	But it isstill a usual observation to make.
					0	Round 2: Author Response to Reviewer 1 Thank you for your comments.
Author	Reviewer_2	4	3	1	1	The revised version went through a professional, native English editing.
Author	Reviewer_1	4	2	2	1	Indeed, it is not a big surprise that the characteristics of national cluster policies and their local implementation are consistent, but still it is our (small but significant) contribution to concretely show the consistency in international comparison with original interviews of cluster managers.
Author	Reviewer_1	4	2	2	1	It is beyond the scope of our manuscript to answer the question as to which model is better for the cluster performance, so we leave it as a future research agenda.
					0	R14 Round 2:
Reviewer_2	Author	3	1	0	2	I wish to congratulate the authors for their careful and thoughtful revision.
Reviewer_2	Author	3	1	0	2	All remarks have been considered, most have been fully incorporated and the paper has gained substantially from revision.
Reviewer_2	Author	3	1	0	2	As a consequence, I can now recommend the paper for publication with minor corrections, including some language editing.
Reviewer_2	Author	3	1	0	2	Since this may be managed by the editorial office, I do not see the need for another review.
					0	Remaining Comments o
Reviewer_2	Author	3	2	0	2	Although the new section 3.1 helps situating the cases within their respective national contexts, it’s focus is on performance indicators.
Reviewer_2	Author	3	2	0	2	If the underlying institutional differences would have been revealed as suggested, this section would be even more valuable for understanding the differences.
Reviewer_2	Author	3	2	0	2	This section now uses the term ‘innovation system’ at the national scale, but there is no discussion of or reference to the concept of national systems of innovation.
Reviewer_2	Author	3	2	0	2	A substantial body of literature has grown on the back of seminal contributions by Edquist (1997), Freeman (1987, 1988, 1995) with reference to Japan, Lundvall (1992), and Nelson (1993).
					0	o
Reviewer_2	Author	3	3	0	2	Although ‘top-down’ and ‘bottom-up’ have been replaced by public-driven and ‘private-driven’, the dichotomist nature remains as the focus of my critique.
Reviewer_2	Author	3	3	0	2	I would still like to see a qualification stating that private and public initiative often interacts in cluster development, and that the degree of private and public sector involvement usually differs from case to case.
					0	o
Reviewer_2	Author	3	4	0	2	P. 11: References on Japan and France should be added to the last two sentences of the first paragraph.
					0	o
Reviewer_2	Author	3	5	0	2	P. 14: On section 4.5 in the first draft, I commented that “Unlike the regional cluster initiatives in Alsace and Baden, the trinational BioValley initiative has hardly had any impact in terms of intensifying cross-border interaction, confirming problems that Koschatzky (2000) had identified long before.
Reviewer_2	Author	3	5	0	2	Indeed, many INTERREG projects fail to overcome the differences in national languages, legislations and cultures, even though the regions are neighbours.” In response, the authors now cite this paper in footnote 14 in Section 3.2. to support the view that BioValley has hardly had any impact in terms of intensifying cross-border interaction.
Reviewer_2	Author	3	5	0	2	This reformulation is incorrect as the Koschatzky (2000) paper pre-dated the BioValley initiative and does not look at INTERREG either.
Reviewer_2	Author	3	5	0	2	Unfortunately, my claim regarding the limited impact of BioValley on cross-border networking draws on conversations with practitioners and a field trip to the region, but cannot be supported by a reference as far as I know.
Reviewer_2	Author	3	5	0	2	I would therefore suggest to drop this footnote altogether.
					0	o
Reviewer_2	Author	3	6	0	2	P. 16: Sources should be stated underneath table 2.
					0	o
Reviewer_2	Author	3	7	0	2	P. 18 (section 4.1, top paragraph): I would rather prefer “a series of national cluster programmes” as part of an evolving policy.
					0	o P. 22: “differences might be attributed to those in innovation systems as basic conditions of clusters.” This is central, so the discussion should be summarised in the conclusions, preferably R15 taking up the three hypotheses: To what extent and how can differences in cluster policies and cluster management be linked to differences in national systems of innovation?
					0	References Edquist, C.
					0	(ed.
					0	), 1997: Systems of Innovation: Technologies, Institutions and Organizations.
					0	London, Washington: Pinter.
					0	Freeman, C., 1987: Technology Policy and Economic Performance: Lessons from Japan.
					0	London, New York: Pinter.
					0	Freeman, C., 1988: Japan: A new National System of Innovation?
					0	In: Dosi, G.; Freeman, C.; Nelson, R.R.
					0	; Soete, L. (eds): Technical Change and Economic Theory.
					0	(=IFIAS Research Series, 6).
					0	London: Pinter, 330-348.
					0	Freeman, C., 1995: The National System of Innovation in Historical Perspective.
					0	In: Cambridge Journal of Economics, 19(1): 5-24.
					0	Lundvall, B.-A.
					0	(ed.).
					0	1992: National Systems of Innovation: Towards a Theory of Innovation and Interactive Learning.
					0	London: Pinter.
					0	Nelson, R.R.
					0	(ed.
					0	), 1993: National Systems of Innovation: A Comparative Study.
					0	Oxford, New York, Toronto: Oxford Univ.
					0	Press.
					0	Round 2: Author Response to Reviewer 2 I wish to congratulate the authors for their careful and thoughtful revision.
					0	All remarks have been considered, most have been fully incorporated and the paper has gained substantially from revision.
					0	As a consequence, I can now recommend the paper for publication with minor corrections, including some language editing.
					0	Since this may be managed by the editorial office, I do not see the need for another review.
					0	*
Author	Reviewer_2	4	3	1	1	Thank you for your recommendation.
Author	Reviewer_2	4	3	1	1	We provided minor corrections to our manuscript based on the following comments. The revised version went through a professional, native English editing.
					0	Remaining Comments Although the new section 3.1 helps situating the cases within their respective national contexts, it’s focus is on performance indicators.
					0	If the underlying institutional differences would have been revealed as suggested, this section would be even more valuable for understanding the differences.
					0	This section now uses the term ‘innovation system’ at the national scale, but there is no discussion of or reference to the concept of national systems of innovation.
					0	A substantial body of literature has grown on the back of seminal contributions by Edquist (1997), Freeman (1987, 1988, 1995) with reference to Japan, Lundvall (1992), and Nelson (1993).
					0	*
Author	Reviewer_2	4	4	2	1	We added a discussion on the national systems of innovation in the first two paragraphs of Section 3.1 (p. 9) referring to the suggested seminal works.
Author	Reviewer_2	4	4	2	1	Moreover, in the remaining part of this section (pp.
Author	Reviewer_2	4	4	2	1	10-11), we added some sentences with supporting references on the underlying institutional differences.
					0	Although ‘top-down’ and ‘bottom-up’ have been replaced by public-driven and ‘private-driven’, the dichotomist nature remains as the focus of my critique.
					0	I would still like to see a qualification stating that R16 private and public initiative often interacts in cluster development, and that the degree of private and public sector involvement usually differs from case to case.
					0	*
Author	Reviewer_2	4	5	3	1	At the beginning of Section 3.2, as well as at the end of the description of each cluster, we mitigated the dichotomist nature in the typology of cluster development by some qualification.
Author	Reviewer_2	4	5	3	1	For example, we changed the formulation from “characterized as public-driven clusters” to “characterized as more public-driven than private-driven clusters”.
					0	P. 11: References on Japan and France should be added to the last two sentences of the first paragraph.
					0	*
