side	opponent	round	number	attacks	ann	text
Author	Reviewer_2	4	6	4	1	We added a new reference on the development in Japan (Okubo and Tomiura 2010) but deleted the sentence about France because we could not show a reference in English.
					0	P. 14: On section 4.5 in the first draft, I commented that “Unlike the regional cluster initiatives in Alsace and Baden, the trinational BioValley initiative has hardly had any impact in terms of intensifying cross-border interaction, confirming problems that Koschatzky (2000) had identified long before.
					0	Indeed, many INTERREG projects fail to overcome the differences in national languages, legislations and cultures, even though the regions are neighbours.” In response, the authors now cite this paper in footnote 14 in Section 3.2. to support the view that BioValley has hardly had any impact in terms of intensifying cross-border interaction.
					0	This reformulation is incorrect as the Koschatzky (2000) paper pre-dated the BioValley initiative and does not look at INTERREG either.
					0	Unfortunately, my claim regarding the limited impact of BioValley on cross-border networking draws on conversations with practitioners and a field trip to the region, but cannot be supported by a reference as far as I know.
					0	I would therefore suggest to drop this footnote altogether.
					0	*
Author	Reviewer_2	4	7	5	1	According to this suggestion, we dropped footnote 14 with the related reference.
					0	P. 16: Sources should be stated underneath table 2.
					0	*
Author	Reviewer_2	4	8	6	1	We added the information sources under the table.
					0	P. 18 (section 4.1, top paragraph): I would rather prefer “a series of national cluster programmes” as part of an evolving policy.
					0	*
Author	Reviewer_2	4	9	7	1	We replaced “policy” by “programs” in this sentence.
Reviewer_2	Author	3	8	0	2	P. 22: “differences might be attributed to those in innovation systems as basic conditions of clusters.” This is central, so the discussion should be summarised in the conclusions, preferably taking up the three hypotheses: To what extent and how can differences in cluster policies and cluster management be linked to differences in national systems of innovation?
					0	*
Author	Reviewer_2	4	10	8	1	In Conclusion, we presented again three hypotheses in a new paragraph in Conclusion after the first paragraph (p. 22).
Author	Reviewer_2	4	10	8	1	Then, in the following paragraph (p. 23) we added a discussion on how differences in cluster policies and cluster management are linked to those in national systems of innovation, with three sentences.
