side	opponent	round	number	attacks	ann	text
					0	ISSN 2076-3387 http://www.mdpi.com/journal/admsci Peer-Review Record: Local Management of National Cluster Policies: Comparative Case Studies of Japanese, German, and French Biotechnology Clusters Hiroyuki Okamuro and Junichi Nishimura Administrative Sciences 2015, 5, 213–239, doi: 10.3390/admsci5040213 Reviewer 1: Anonymous Reviewer 2: Anonymous Editor: Maximilian Benner (Guest Editor of Cluster Policy: Institutional and International Perspectives) Received: 27 April 2015 / Accepted: 27 October 2015 / Published: 3 November 2015 1.
					0	First Round of Evaluation Round 1: Interesting idea to look at the impact of cluster policy/program design on the cluster (initiative management).
					0	Also sound profiling of the different cluster programs and initiatives.
Reviewer_1	Author	1	1	0	2	But the analysis of the data is weak, and the paper remains largely descriptive.
Reviewer_1	Author	1	1	0	2	Would suggest to use these case studies as a source of ideas on how policies and cluster initative management migth relate to each other; that would make this a more interesting paper.
Reviewer_1	Author	1	2	0	2	Ultimately there is then also the question of how this interaction affects performance and what policy implications the authors see (should policies be changed; should cluster initiative managers make different choices; can they if policies are given).
Reviewer_1	Author	1	3	0	2	The conceputal framework (figure 1) is very similar to the 'cluster initiative performance model' in the Cluster Initiative Greenbook (Solvell et al., 2003), adding the hypothesis that there might be an interaction between policy context and management and being somewhat more narrow on the elements included.
Reviewer_1	Author	1	3	0	2	There are also existing reviews of cluster policies in Europe that should be considered (Clusters are Individuals, 2012, BMWi; VDI/VDE; Dasti).
Reviewer_1	Author	1	3	0	2	"There is also a growing literature on cluster initiative management in Europe (see the EU's ""Excellence Initiative' with the benchmarking of cluster initiatives) that should be considered."
Reviewer_1	Author	1	4	0	2	The language the authors use is here a bit imprecise - they seem to be talking about the management of cluster initiatives, not about the management of the policies themselves (which is more a question of how the program oversight is organized within government; also an interesting but different question).
					0	R2 Round 1: Author Response to Reviewer 1 We are very grateful for your valuable comments and suggestions, which help improve our manuscript significantly.
					0	We tried to consider the comments and suggestions as far as possible in revising our manuscript.
					0	In the following, we will reply to each of your comments, using blue letters for our responses.
					0	But the analysis of the data is weak, and the paper remains largely descriptive.
					0	Would suggest to use these case studies as a source of ideas on how policies and cluster initiative management might relate to each other; that would make this a more interesting paper.
					0	*
Author	Reviewer_1	2	1	1	1	We fundamentally reorganized our manuscript so that its story and structure might be much clearer in the revision.
Author	Reviewer_1	2	1	1	1	In Section 2.2 we explicitly presented three hypotheses that are tested and discussed in later sections using information on six cluster cases.
Author	Reviewer_1	2	1	1	1	Section 5 also was reorganized so that the relationship of local cluster management to basic conditions and to national cluster polity, respectively, could be tested for each country using some cases of clusters and cluster management.
					0	The conceptual framework (figure 1) is very similar to the 'cluster initiative performance model' in the Cluster Initiative Greenbook (Solvell et al., 2003), adding the hypothesis that there might be an interaction between policy context and management and being somewhat more narrow on the elements included.
					0	There are also existing reviews of cluster policies in Europe that should be considered (Clusters are Individuals, 2012, BMWi; VDI/VDE; Dasti).
					0	"There is also a growing literature on cluster initiative management in Europe (see the EU's ""Excellence Initiative' with the benchmarking of cluster initiatives) that should be considered."
					0	*
Author	Reviewer_1	2	2	3	1	We revised and simplified Figure 1 by deleting cluster performance and its relationships with other factors because in fact we do not address them in our manuscript.
					0	*
Author	Reviewer_1	2	3	3	1	We read and cited in our manuscript the suggested and other references that correspond to [25], [31], [32], [33], [34], [35] and [36] (especially in Section 2.2) in revising our conceptual framework.
					0	The language the authors use is here a bit imprecise - they seem to be talking about the management of cluster initiatives, not about the management of the policies themselves (which is more a question of how the program oversight is organized within government; also an interesting but different question).
					0	*
Author	Reviewer_1	2	4	4	1	This manuscript addresses the relationship of national cluster policy and its local implementation, and not the policy organization within the government.
Author	Reviewer_1	2	4	4	1	Therefore, we slightly changed the titles of the manuscript and Section 5, and revised related terms throughout the manuscript, using the terms such as “local implementation” or “local management”.
					0	Round 1: Referee Report for Administrative Sciences Management of cluster policies for innovation: Comparative case studies of Japanese, German, and French biotechnology clusters Manuscript no.
					0	admsci-85306 R3 Brief Summary The paper tackles a relevant topic and takes up an important research deficit, i.e.
					0	the interface between national cluster policies and cluster management on the ground, and thus makes an original contribution to our understanding of cluster policies and their implementation.
					0	It develops a conceptual frame for the comparative analysis of cluster policies and applies it to six case studies in three countries.
					0	The paper is well-written and organised.
Reviewer_2	Author	1	1	0	2	However, it remains predominantly descriptive in its present state, and does not seek to explain the differences found in both countries.
Reviewer_2	Author	1	1	0	2	When revising the paper, the authors are advice to add a theoretical/conceptual frame that allows them to strengthen the paper’s explanatory value.
					0	In sum, I recommend that the paper be reconsidered after a major revision.
					0	The authors might find the following major and minor comments helpful when revising their paper.
					0	Broad Comments The paper fills an important research deficit by focusing on the interdependence between national cluster policy programmes and their implementation by cluster management on the ground.
					0	Its main contributions lie in the conceptual framework displayed in figure 1 and its application to six case studies from three countries.
Reviewer_2	Author	1	2	0	2	However, the conceptual framework appears simplistic, technocratic and static, and it is not sufficiently rooted in literature as evident from the scarcity of references in section 2.2.
Reviewer_2	Author	1	3	0	2	It is simplistic and technocratic because it views cluster performance as an outcome of initial conditions (i.e., the state of cluster development), cluster management and national polices.
Reviewer_2	Author	1	3	0	2	The paper thus rests on the untested presumption that cluster management and national policies actually impact the performance of clusters.
Reviewer_2	Author	1	4	0	2	As scholars, the authors should challenge this technocratic faith of policy-makers and practitioners, although evaluation is beyond this paper’s scope.
Reviewer_2	Author	1	4	0	2	The performance of clusters is also affected by many exogenous influences not captured in the simple model.
Reviewer_2	Author	1	5	0	2	Furthermore, ‘initial conditions’ fail to capture the complexity of clusters if they are reduced to a dichotomy of private vs. public sector dominance.
Reviewer_2	Author	1	5	0	2	Even when the industry (biotechnology) is held constant, clusters differ in a number of ways, esp.
Reviewer_2	Author	1	5	0	2	regarding their specialisation within biotechnology, their maturity, size (number of firms and employee) and firm size structure.
Reviewer_2	Author	1	6	0	2	Finally, the paper is static as it does not account for cluster evolution and (policy) learning over time.
Reviewer_2	Author	1	6	0	2	For instance, what does it mean if a regional cluster organisation is pre-dating the national policy programme it is supposed to implement, as evident from some of the cases?
Reviewer_2	Author	1	6	0	2	Such limitations do not necessarily disqualify the paper, but should be discussed reflexively in the paper’s conclusions.
Reviewer_2	Author	1	7	0	2	At present, the final section is merely a summary with the exception of the very last sentence briefly sketching the need for including evaluation in comparative cluster policy research.
					0	The paper contributes to comparative cluster policy research and thus helps overcoming the prevailing focus on individual case studies.
Reviewer_2	Author	1	8	0	2	However, it remains rather descriptive and does not systematically attempt to explain the differences found between the three countries.
					0	The authors conclude that they found ‘consistent combinations of the types of national policies, local clusters, and cluster management’.
Reviewer_2	Author	1	9	0	2	This appears hardly surprising given the co-evolution of policies and cluster management within a common institutional environment.
Reviewer_2	Author	1	9	0	2	A conceptual and/or theoretical perspective is needed to shed light at the differences found.
					0	The authors should include a discussion on how these R4 countries differ e.g.
Reviewer_2	Author	1	10	0	2	in terms of the role of the state versus private initiative, governance traditions and philosophies, centralist vs. federal set-up.
					0	As Kiese (2009) showed for three European Countries including Germany and France, these differences leave an imprint on the design and implementation of national cluster policies.
					0	The varieties of capitalism (VoC) concept developed by HALL/SOSKICE (2011) may be a suitable concept here, as it has been applied to cluster policies in the U.S. and Germany by STERNBERG ET AL. (2010).
					0	Since Japan, France and Germany are all classified as co-ordinated market economies in the original VoC concept, more nuanced differentiations of capitalisms – or other institutional frameworks – might be recommended for the paper.
					0	The authors focus on what they call ‘intellectual clusters’, a term that appears 21 times throughout the paper although I cannot recall having ever seen it in a decade or so of studying clusters and cluster policies.
Reviewer_2	Author	1	11	0	2	According to the definition on the top of page 4, the term denotes a cluster led by a public research organisation, which is rather specific and I doubt it applies to the six case studies outlined in the paper.
Reviewer_2	Author	1	11	0	2	Even so, the term ‘intellectual’ does not look fully appropriate here, which may be due to its translation from a Japanese original.
Reviewer_2	Author	1	11	0	2	‘Public research-led cluster’ might be more to the point, as it appears difficult to judge if these are more or less ‘intellectual’ than other forms of clusters.
Reviewer_2	Author	1	11	0	2	At the least, it would appear sound to qualify these six cases as science-based clusters, but then this would apply to the biotech industry and all its clusters in general.
					0	Methodology: The choice of clusters is generally well explained on pp.
					0	2-3.
					0	When elaborating on the choice of nations, one might wonder why the United States have not been included – possibly because there is no comparable national cluster policy?!
Reviewer_2	Author	1	12	0	2	When explaining the choice of regional cases, the term ‘representative’ appears misleading.
					0	It seems that the most prominent or successful cases have been selected, at least for Germany and France.
					0	How can these be ‘representative’ for whatever population of biotech clusters in these countries?
Reviewer_2	Author	1	13	0	2	When outlining their research methodology, the authors should state precisely how many interviews they conducted.
Reviewer_2	Author	1	13	0	2	It looks as if one interview was done with the cluster manager in the six regions, but the authors also claim to have interviewed ‘the presidents of cluster firms’ (p. 8, line 20) without indicating the number.
Reviewer_2	Author	1	14	0	2	Given the conceptual framework outlined in figure 1, one might also wonder why national policymakers, i.e.
Reviewer_2	Author	1	14	0	2	representatives of the respective national cluster programmes, have not been surveyed as well.
Reviewer_2	Author	1	15	0	2	Furthermore, some reflection on the adopted comparative case study research design with references would be desirable.
					0	Section 4: The presentation of the six case studies is very systematic and clear.
Reviewer_2	Author	1	16	0	2	However, sections 4.3 to 4.5 leave an impression that the assessment of these cases as ‘bottom-up’ is not completely justified.
Reviewer_2	Author	1	16	0	2	The authors seem to assume that cluster policies are either bottom-up or top-down, without any shades of grey in between.
					0	Compared to the Japanese cases, the French and German cases are clearly more bottom-up, but they still display clear – if not dominant – elements of top-down governance and public agency.
					0	This dichotomy should be refined and the classification of cases qualified as, e.g., ‘relatively bottom-up’.
					0	For the German cases, the authors may have underestimated public agency, since they did not investigate the role of state governments (Bavaria, Baden-Württemberg) within the country’s system of multilevel governance, which is key to understand cluster policies in Germany (cf.
					0	KIESE 2013).
					0	Furthermore, the state government of R5 Bavaria may be a regional government, but it is certainly not a local authority (like the city of Munich; page 15, line 29) in Germany’s system of multilevel governance.
Reviewer_2	Author	1	17	0	2	Section 5 does not include any reference and is purely descriptive and sometimes even superficial, lacking any comparison, explanation or assessment.
					0	This is probably the result of a rather weak empirical basis, provided it draws on interviews with a total of six cluster managers.
					0	Critical issues such as the cluster management organisation’s budget and finance have not been addressed.
					0	The relevance of the information presented here for the following discussion and conclusion remain far from clear.
					0	In my humble opinion, this is the weakest part of the paper that might well be omitted and replaced by a suitable conceptual frame for international comparison, as outlined above.
Reviewer_2	Author	1	18	0	2	As also elaborated above, the conclusion should go beyond a mere summary to include methodological reflection, implications for policy (learning), as well as a more extensive discussion of further research perspectives.
					0	Specific Comments
Reviewer_2	Author	1	19	0	2	Page 3, line 3: The authors might want to link to the literature on differentiated knowledge bases, which assigns an analytical (science-based) knowledge base to the biotech industry (cf.
Reviewer_2	Author	1	19	0	2	ASHEIM ET AL. 2011).
Reviewer_2	Author	1	20	0	2	Page 4, line 23: ‘few studies’ – If you mean ‘few’, please state the references.
Reviewer_2	Author	1	20	0	2	If ‘few’ means ‘no’, then please say so straightaway.
Reviewer_2	Author	1	21	0	2	Page 6, line 25: I would suggest softening the statement that matched funding ‘prevents moral hazard and crowding out’.
Reviewer_2	Author	1	21	0	2	It certainly helps preventing, partly prevents, or reduces the risk of these problems occurring.
Reviewer_2	Author	1	22	0	2	Section 2 contains a number of “expectations”, which could be flagged out and numbered as hypotheses.
Reviewer_2	Author	1	22	0	2	Taking these up in the empirical discussion could help the reader’s orientation.
Reviewer_2	Author	1	23	0	2	Page 8, lines 1-2: This is interesting indeed.
Reviewer_2	Author	1	23	0	2	Is there comparable evidence on policy learning between Germany and France?
Reviewer_2	Author	1	23	0	2	Timing and content suggest that French national policies may well have been inspired by the German BioRegio contest.
Reviewer_2	Author	1	24	0	2	Page 10, line 19 – ‘several cluster policies’: I would address this family of related programmes as one policy rather than many.
Reviewer_2	Author	1	25	0	2	Page 10, line 28: The number of 85 applicants contains some clusters who applied more than once in the three rounds of the contest.
Reviewer_2	Author	1	26	0	2	Section 3.3: There is a little bit of literature on French national cluster policy that deserves a brief review or at least reference here (e.g., BRETTE/CHAPPOZ 2007, DURANTON ET AL.
Reviewer_2	Author	1	26	0	2	2010, LONGHI/ROCHHIA 2013).
Reviewer_2	Author	1	27	0	2	Page 12, lines 11-12: Table 2 provides a descriptive summary, but no ‘explanation’ – see major comments.
Reviewer_2	Author	1	28	0	2	Page 14, line 21: How can this be a cluster if there are ‘only a few biotech ventures’?
Reviewer_2	Author	1	28	0	2	If the aim of public policy is to grow a cluster around a research organisation or hospital, this does not seem to produce any meaningful outcomes as yet.
					0	R6
Reviewer_2	Author	1	29	0	2	Page 15, lines 22-23: ‘Large firms are on the whole not active in clusters’ – As a general statement, this is certainly not true.
Reviewer_2	Author	1	30	0	2	Page 15, line 24: Here and elsewhere, universities are attributed with the term ‘famous’.
Reviewer_2	Author	1	30	0	2	This should be backed up with evidence (data) and preferably rephrased, such as ‘recognised research universities’, or ‘elite’ with reference to the German federal government’s programme of university excellence (Exzellenzinitiative).
Reviewer_2	Author	1	31	0	2	Page 15, line 27: Repetition – the IZB incubator was already mentioned on line 9.
Reviewer_2	Author	1	32	0	2	Section 4.5: Unlike the regional cluster initiatives in Alsace and Baden, the trinational BioValley initiative has hardly had any impact in terms of intensifying cross-border interaction, confirming problems that KOSCHATZKY (2000) had identified long before.
Reviewer_2	Author	1	32	0	2	Indeed, many INTERREG projects fail to overcome the differences in national languages, legislations and cultures, even though the regions are neighbours.
Reviewer_2	Author	1	33	0	2	The layout of the tables may be improved, especially the spacing of the text.
Reviewer_2	Author	1	34	0	2	The paper contains funding information in Yen and Euros.
Reviewer_2	Author	1	34	0	2	This should be harmonised, or preferably conversions given in brackets or footnotes for the reader’s convenience.
Reviewer_2	Author	1	35	0	2	The paper is well-written and makes fluent reading, but still requires some minor language editing.
Reviewer_2	Author	1	35	0	2	Recurring mistakes include the use of articles (a/the) and singular versus plural (the singular of consortia is consortium).
					0	References ASHEIM, B.T.
					0	; BOSCHMA, R.; COOKE, P., 2011: Constructing regional advantage: Platform policies based on related variety and differentiated knowledge bases.
					0	In: Regional Studies, 45(7): 893-904.
					0	BRETTE, O.; CHAPPOZ, Y., 2007: The French competitiveness clusters: Toward a new public policy for innovation and research?
					0	In: Journal of Economic Issues, 41(2): 391-398.
					0	DURANTON, G.; MARTIN, P.; MAYER, T.; MAYNERIS, F., 2010: The economics of clusters: Lessons from the French experience.
					0	(=Studies of Policy Reform).
					0	Oxford: Oxford Univ.
					0	Press.
					0	HALL, P.A.
					0	; SOSKICE, D., 2001: An introduction to varieties of capitalism.
					0	In: Hall, P.A.
					0	; Soskice, D. (eds): Varieties of capitalism: The institutional foundations of comparative advantage.
					0	Oxford: Oxford Univ.
					0	Press, 1-68.
					0	KIESE, M., 2009: National styles of cluster promotion: Cluster policies between variety and convergence.
					0	In: Hagbarth, L.
					0	(ed.
					0	): Innovative city and business regions.
					0	(=Structural change in Europe, 6).
					0	Bollschweil: Hagbarth Publications, 57-67.
					0	KIESE, M., 2013: Regional cluster policies in Germany – A multi-level governance perspective on policy learning.
					0	In: European Review of Industrial Economics and Policy (5).
					0	http://revel.unice.fr/eriep/index.html?id=3543, accessed March 13th, 2015.
					0	KOSCHATZKY, K., 2000: A river is a river – Cross-border networking between Alsace and Baden.
					0	In: European Planning Studies, 8(4): 429-449.
					0	R7 LONGHI, C.; ROCHHIA, S., 2013: Cluster policy for innovation and competitiveness: Lessons from the French experience.
					0	In: European Review of Industrial Economics and Policy (5).
					0	http://revel.unice.fr/eriep/index.html?id=3495, accessed June 13, 2015.
					0	STERNBERG, R.; KIESE, M.; STOCKINGER, D., 2010: Cluster policies in the US and Germany: Varieties of capitalism perspective on two high-tech states.
					0	In: Environment and Planning C, 28(6): 1063-1082.
					0	Round 1: Author Response to Reviewer 2 We are very grateful for your detailed, insightful comments and suggestions, which help improve our manuscript significantly.
					0	We tried to consider the comments and suggestions as far as possible in revising our manuscript.
					0	In the following, we will reply to each of your comments, using blue letters for our responses (underlines in the comments by the authors).
					0	Broad Comments • However, the conceptual framework appears simplistic, technocratic and static, and it is not sufficiently rooted in literature as evident from the scarcity of references in section 2.2.
					0	*
Author	Reviewer_2	2	5	2	1	We revised the concept and its explanation, and added some references in Section 2.2 and in Introduction.
Author	Reviewer_2	2	5	2	1	For more details, please see below.
					0	• It is simplistic and technocratic because it views cluster performance as an outcome of initial conditions (i.e., the state of cluster development), cluster management and national polices.
					0	The paper thus rests on the untested presumption that cluster management and national policies actually impact the performance of clusters.
					0	As scholars, the authors should challenge this technocratic faith of policy-makers and practitioners, although evaluation is beyond this paper’s scope.
					0	The performance of clusters is also affected by many exogenous influences not captured in the simple model.
					0	*
Author	Reviewer_2	2	7	4	1	In this manuscript, we do not intend to demonstrate direct performance effect of cluster conditions, cluster policy, and cluster management.
Author	Reviewer_2	2	7	4	1	This is beyond the scope of our paper.
Author	Reviewer_2	2	7	4	1	It would be an important research topic to challenge the “technocratic faith”, but we cut the discussion about the factors of cluster performance from the text and Figure 1 in order to avoid any misunderstanding.
Author	Reviewer_2	2	7	4	1	Instead, we added a detailed discussion about “initial conditions” (now “basic conditions”) of clusters in Section 2.2 and 3.1 (a new section).
					0	• Furthermore, ‘initial conditions’ fail to capture the complexity of clusters if they are reduced to a dichotomy of private vs. public sector dominance.
					0	Even when the industry (biotechnology) is held constant, clusters differ in a number of ways, esp.
					0	regarding their specialisation within biotechnology, their maturity, size (number of firms and employee) and firm size structure.
					0	*
Author	Reviewer_2	2	8	5	1	In page 4 below in Section 2.2, we added a brief explanation of the “initial” (now “basic”) conditions of clusters. There we suggested that they comprise various regional characteristics and that also R8 scientific or industrial focus may differ across clusters within life science or biotechnology.
					0	In the new Section 3.1, we explained the differences of basic conditions in more detail.
					0	• Finally, the paper is static as it does not account for cluster evolution and (policy) learning over time.
					0	For instance, what does it mean if a regional cluster organisation is pre-dating the national policy programme it is supposed to implement, as evident from some of the cases?
					0	Such limitations do not necessarily disqualify the paper, but should be discussed reflexively in the paper’s conclusions.
					0	At present, the final section is merely a summary with the exception of the very last sentence briefly sketching the need for including evaluation in comparative cluster policy research.
					0	*
Author	Reviewer_2	2	10	7	1	It is true that in some cases local cluster organization had been established and had started its activity before the focal cluster policy started.
Author	Reviewer_2	2	10	7	1	Because of limited information, we could not sufficiently consider cluster and policy dynamics over time, but referred to the lack of dynamic approach in our study in the conclusion.
					0	• The paper contributes to comparative cluster policy research and thus helps overcoming the prevailing focus on individual case studies.
					0	However, it remains rather descriptive and does not systematically attempt to explain the differences found between the three countries.
