side	opponent	round	number	attacks	ann	text
					0	Survey measures Category GH NR BDE Median (IQR) Sig.
					0	Median (IQR) Sig.
					0	Median (IQR) Sig.
					0	Gender Male 15.00 (2.00) .024* 15.00 (2.00) .000* 42.00 (5.00) .950 female 15.00 (3.00) 14.00 (3.00) 42.00 (6.00) Age 21-25 16.00 (3.00) .009* 15.00 (3.00) .004* 43.00 (4.00) .115 26-35 15.00 (2.00) 15.00 (3.00) 42.00 (5.00) 36-45 15.00 (4.00) 13.50 (3.00) 41.00 (6.00) 46-60 15.50 (2.00) 15.00 (2.00) 40.50 (6.00) Educational level Secondary school or equivalent 14.00 (4.00) .384 14.00 (2.00) .656 39.00 (6.00) .391 Diploma or college certificate 15.00 (2.00) 15.00 (3.00) 42.00 (5.00) Master's degree or above 15.00 (2.00) 14.00 (3.00) 42.00 (5.00) Weekly work hours 30 to 40 hours 14.00 (2.00) .742 14.00 (3.00) .445 41.00 (6.00) .919 41 to 50 hours 15.00 (2.00) 14.00 (3.00) 42.00 (5.00) Above 50 hours 15.00 (3.00) 15.00 (3.00) 42.00 (5.00) Daily sedentary time Within 30 min 15.00 (2.00) .549 15.00 (2.00) .216 42.00 (5.00) .652 30 min to 2 hours 14.00 (3.00) 13.00 (4.00) 43.00 (5.00) 2 to 5 hours 15.00 (2.00) 14.00 (4.00) 42.00 (5.00) 5 to 8 hours 15.00 (2.00) 15.00 (3.00) 41.00 (5.00) Above 8 hours 15.00 (2.00) 14.50 (4.00) 41.00 (7.00) Work desk location Window seats with natural views 15.00 (3.00) .751 14.00 (3.00) .228 42.00 (5.00) .703 Window seats with urban views 16.00 (2.00) 14.00 (1.00) 42.00 (5.00) Aisle seats without window view 15.00 (2.00) 14.00 (3.00) 42.00 (5.00) Working years (in this company) 1 year or less 15.00 (2.00) .218 15.00 (3.00) .531 42.00 (5.00) .458 1-3 years 15.00 (3.00) 14.00 (4.00) 42.00 (7.00) 3-5 years 15.00 (3.00) 14.50 (3.00) 42.00 (6.00) Above 5 years 15.00 (2.00) 14.00 (3.00) 41.00 (6.00) Office location Singapore 15.00 (2.00) .995 14.00 (3.00) .701 41.00 (5.00) .244 Shenzhen, China 15.00 (3.00) 15.00 (3.00) 43.00 (5.00) Point 14: Table 8: Please consider applying benchmarks for what constitute reasonable levels for internal consistency, when using the Cronbach’s Alpha (e.g., α>0.7): Please see, for example: Taber, 2018.
					0	The use of Cronbach’s Alpha when developing and reporting research instruments in science education.
					0	Research in Science Education.
					0	Tavakol et al.
					0	Making sense of Cronbach’s Alpha.
					0	International Journal of Medical Education.
					0	Response 14: Thank you for your suggestion.
					0	The Cronbach’s Alpha with an Alpha>0.6 considered acceptable internal consistency in this study.
					0	The statement and the references are added in the revised version.
					0	Revision in Page 13 Line 381-383: “The Cronbach’s α coefficient value of the main scale is 0.72, while those of the sub-scales GH, NR, and BDE in order are obtained as 0.68, 0.79, and 0.63, indicating that the questionnaire is reliable (i.e., an acceptable reliability: Cronbach's α>0.6) [57, 58] (Table 8).” Citations are added in the Reference list: 57.
					0	Morgan, P. J., Cleave‐Hogg, D., DeSousa, S., Tarshis, J., 2004.
					0	High‐fidelity patient simulation: validation of performance checklists.
					0	British Journal of Anesthesia, Volume 92, (3) 388–392.
					0	58.
					0	Cronbach, L.J., 1951.
					0	Coefficient Alpha and the Internal Structure of tests, Psychometrika.
					0	Vol.
					0	6.
					0	3.
					0	297-334.
					0	Point 15: Figure 3.
					0	The plot is well presented.
					0	A few minor notes for improvement: 1) Please consider adding short or abbreviated labels referring to the actual question, instead of codes (e.g., GH3-Q10).
					0	This would make it easier for the reader; 2) Round the percentages to the nearest whole number.
					0	Response 15: 1) Abbreviated labels referring to the actual questions are added in the Figure 3 (Figure 2 in the revision).
					0	But 2) we keep the original percentages (round to one decimal place).
					0	We think it is not hard for the readers to understand, and the original percentages (round to one decimal place) is more accurate.
					0	Revision in Page 17 Line 431: Point 16: P17, L434: Please correct the unfortunate citation error on this line.
					0	Response 16: Thanks for the reminder, the error has been corrected in the revised version.
					0	Revision in Page 21 Line 473: “According to Table 10, Pearson correlations indicate that…” Point 17: P18, section 4.2: Similar to comment #13, the data may be more suited to a Spearman’s correlation test, instead of the Pearson’s correlation coefficient.
					0	Due to the reasonable size of the dataset collected, it may not change the interpretation, but would help improve the analytical rigor.
					0	Response 17: Spearman’s correlation test was conducted, and the revised contents are shown in the updated version.
					0	Revision in Page 17 Line 440: “Second, Spearman's correlation analysis is utilized to examine the correlation between three subscales.” Revision in Page 21 Line 472-483: 4.2.
					0	Intercorrelation between the three subscales (GH, NR, BDE) “According to Table 10, Spearman's correlations indicate that works' nature relatedness (NR) was positively correlated with self-evaluated GH (r = .264**, p < .01).
					0	This result also confirms the previously obtained results that people who had a higher evaluation in nature relatedness are also had a higher evaluation on their health.
					0	When the occupants feel that they have a strong sense of relationship with nature, it is observed that the biophilic environment would have positive impacts on their health.
					0	More importantly, significant correlation is also found in between biophilic design evaluation and self-reported health (GH), r=.270**, p < .01, indicating that office biophilic design has positive values on workers’ psychological health.” Table 10.
					0	Intercorrelations between responses of three subscales.
					0	GH NR BDE General Health - .264** .270** Nature Relatedness .264** - .135 Biophilic Design Evaluation .270** .135 - **.
					0	Correlation is significant at the 0.01 level (2-tailed) Point 18: P18, L448-450: Please check whether the sentence is accurate and correct the table caption numbers; I believe these should be Tables 10 and 11 and 12, not 1, 2 and 3.
					0	The sentence reads: Homogenous subsets with significant discrepancies (differences?)
					0	across subsets, leading to no significant differences across subsets.
					0	The above is not easy to grasp.
					0	If the information is accurate, please consider amending this to make this clearer.
					0	Response 18: Thank you for your comment.
					0	The above contents have been corrected in the revised version.
					0	Point 19: While the conclusions were well structured, I felt the authors could have highlighted more the main takeaway messages from their endeavors, in particularly the relationship between biophilic design and occupant health and wellbeing.
					0	This seems to be a core aspect of their work but did really emerge from the final section of their work in the same way it was emphasized in the abstract.
					0	Response 19: The Conclusion is rewritten to highlight the relationship between biophilic design and occupant health and wellbeing: Revision in Page 23 Line 514-540: “The significant research outputs from the present scrutiny are shown as following: a) The authors develop a POE questionnaire for evaluating the biophilic design for workplace health and wellbeing.
					0	The investigation explains that combined literature review and POE results are one of the practical methodologies to establish biophilic design frameworks for specific workplace typology.
					0	And the questionnaire can be applied in future biophilic design research for investigation.
					0	b) Additionally, the study provides novel design guidelines for designers with emphasizing on weight for workplace design practices.
					0	The weighting results of this study would be especially applicable to the workplace typology.
					0	The 14 Patterns of Biophilic Design has a broader range of usage for all building typologies and is more suitable for general design applications.
					0	Therefore, the weighting results of this experiment are not employed to deny the ranking in the 14 Patterns of Biophilic Design.
					0	These are exploited to show a new biophilic design framework for the workplace according to the users’ points of view (based on the POE results).
					0	c) Furthermore, the questionnaire results enhance our knowledge on the practical ap-plication of biophilic design frameworks for the workplace and contributed to more framework design consideration.
					0	d) The correlation results support the importance of biophilic design from the user perspectives.
					0	There is a significant correlation between office biophilic design and self-reported health of employees (r=.270**, p < .01).
					0	e) The study results contribute to provide designers with evidence-based design at-tributes for workplace design (i.e., the nine selected workplace biophilic design attributes).” 2 1
					0	Response to Reviewer 2 Comments Point 1: The study about the evaluation of biophilic attributes in the workplace for improving health and wellbeing is actual and interesting and therefore the paper is fulfilling the scientific criteria to be published.
					0	Practical methodologies to establish biophilic design frameworks for specific workplace typology.
					0	Response 1: Thank you for your comments and suggestions.
					0	2 1
					0	Response to Reviewer 1 Comments Point 1: The introduction can be optimized appropriately.
					0	"The introduction of the term ""Biophilia"" can be more detailed and easier to understand."
					0	By contrast, the introduction of “Biophilic Design” is very substantial.
					0	It may be better to find some literature to combine workplace design and “Biophilic Design”, and then to explore the relationship between them.
					0	Response 1: 1) Further explanations of “Biophilia” are added in the Introduction.
					0	"Revision in Page 1 Line 27-29: “The term ""Biophilia"" is evolved from human evolution research and is coined to describe humans' inherent love affinity for the living things in the natural world [1,2]."
					0	It explained why we prefer nature because it is an instinct deeply rooted in the human brain.” 2) Literatures are added in the revised version to combine “workplace design” and “Biophilic Design”.
					0	Revision in Page 2 Line 48-53: “Workplace is one of the typologies that attracts the attentions of researchers.
					0	Scholars who research the relationship between the built environment and health found that the environment not merely directly or indirectly affects human health but also affects their work and study performance [59].
					0	Studies proofed that biophilic design benefits workers’ health and productivity in an office environment [60, 61, 62, 63].” Citations are added in the Reference list: 59.
					0	Derek, C. C., 2003.
					0	Environmental Quality and the Productive Workplace.
					0	In C. J. Anumba (Ed.
					0	), Innovative Developments in Architecture, Engineering and Construction.
					0	Rotterdam: Millpress Science Publishers.
					0	60.
					0	Lei, Q.H., Yuan, C., Lau, S.S.Y., 2021.
					0	A quantitative study for indoor workplace biophilic design to improve health and productivity performance.
					0	Journal of Cleaner Production.
					0	324, 129168.
					0	61.
					0	Yin, J., Zhua, S., MacNaughton, P., Joseph, G., Allen, J.G., Spengler, J.D., 2018.
					0	Physiological and cognitive performance of exposure to biophilic indoor environment.
					0	Build.
					0	Environ.
					0	132, 255–262.
					0	62.
					0	Yin, J., Arfaei, N., MacNaughton, P., Catalano, P.J., Allen, J.G., Spengler, J.D., 2019.
					0	Effects of biophilic interventions in office on stress reaction and cognitive function: a randomized crossover study in virtual reality.
					0	Indoor Air 29, 1028–1039.
					0	https:// doi.org/10.1111/ina.12593.
					0	63.
					0	Yin, J., Yuan, J., Arfaei, N., Catalano, P.J., Allen, G.J., Spengler, J.D., 2020.
					0	Effects of biophilic indoor environment on stress and anxiety recovery: a between-subjects experiment in virtual reality.
					0	Environ.
					0	Int.
					0	136, 105427. https://doi.org/10.1016/j.
					0	envint.2019.105427.
					0	Point 2: The illustrations in the article are small and a bit vague, some pictures can shrink a little, not to the top to the border, these can be optimized.
					0	Response 2: Thanks for your suggestion.
					0	The figures and pictures have been adjusted in the revised manuscript.
					0	Point 3: Overall work of the article is sufficient, the results have the certain significance, but its limitation is obvious to all.
					0	Some of the results in the illustrations are obvious and can be reduced to less elaboration.
					0	Response 3: Thanks for your suggestion.
					0	The figures and pictures have been adjusted in the revised manuscript.
					0	The Section 3 Questionnaire Results and Section 4 are rewritten in the revised version: a) the statistical analysis is modified; b) to reduce elaboration in the text.
					0	Please kindly refer the following revisions: 1) The original Section 3.1.
					0	Observation Results-Biophilic Design Attributes in the Selected Offices is moved to be Section 2.3.2.
					0	It is because the 2.3.1 is the selection of office, and the Section 2.3.2 provides observation details of the selected offices.
					0	After re-construction, Section 3.
					0	Questionnaire Results focus on illustrating the questionnaire results.
					0	2) In the revised version, the formulars in Section 3.3 2.
					0	Quantitative Results of Impacts of Biophilic Design for Workplace are removed due to the statistical analysis is modified: The means (SD) are only applied when the assumption of normality applies for the datasets.
					0	Hence, all the means (SD) are replaced as medians (IQR).
					0	And the corresponding figures (Figure 1 in Page 13 Line 359-361 and Figure 4 in Page 16-17 of the original manuscript) are removed in the revised version.
					0	Revision in Page 13 Line 381-394: The Cronbach’s α coefficient value of the main scale is 0.72, while those of the subscales GH, NR, and BDE in order are obtained as 0.68, 0.79, and 0.63, indicating that the questionnaire is reliable (i.e., an acceptable reliability: Cronbach's α>0.6) [57, 58] (Table 8).
					0	According to the quantitative results presented in Table 8, the medians (Interquartile Range, IQR) of the assessment show moderately high opinions toward the health and wellbeing of biophilic offices (HWBO), at 71.00 (8.00) (the score range from min.
					0	20 to max.
					0	100).
					0	Concerning the self-related evaluation scales GH and NR, the score range of GH and HR are minimum 4 to maximum 20, and the obtained results illustrate moderately high opinions, the values of 15.00 (2.00) and 14.00 (3.00) for GH and NR.
					0	The median (IQR) value of the POE scale BDE is evaluated as 42.00 (5.00) (range of total value: min.
					0	12 to max.
					0	60).
					0	Table 8.
					0	Medians, Interquartile Range (IQR), Mean, standard deviation, and α coefficient values of workers’ evaluation based on HWBO, GH, NR, and BDE.
					0	Structure (item) Scale Median (IQR) Cronbach’s α Main scale (1) Health and Wellbeing of Biophilic Offices (HWBO) 71.00 (8.00) .72 Subscales of main scale (3) General Health (GH) 15.00 (2.00) .68 Nature Relatedness (NR) 14.00 (3.00) .79 Biophilic Design Evaluation (BDE) 42.00 (5.00) .63 Revision in Page 18 Table 9: Table 9.
					0	Comparison of independent variables (Gender, Age, Educational Levels, Weekly Work Hours, Daily Sedentary Time, Work Desk Locations, Working Years, Office Locations) on self-reported GH, NR, and BDE.
					0	Survey measures Category GH NR BDE Median (IQR) Sig.
					0	Median (IQR) Sig.
					0	Median (IQR) Sig.
					0	Gender Male 15.00 (2.00) .024* 15.00 (2.00) .000* 42.00 (5.00) .950 female 15.00 (3.00) 14.00 (3.00) 42.00 (6.00) Age 21-25 16.00 (3.00) .009* 15.00 (3.00) .004* 43.00 (4.00) .115 26-35 15.00 (2.00) 15.00 (3.00) 42.00 (5.00) 36-45 15.00 (4.00) 13.50 (3.00) 41.00 (6.00) 46-60 15.50 (2.00) 15.00 (2.00) 40.50 (6.00) Educational level Secondary school or equivalent 14.00 (4.00) .384 14.00 (2.00) .656 39.00 (6.00) .391 Diploma or college certificate 15.00 (2.00) 15.00 (3.00) 42.00 (5.00) Master's degree or above 15.00 (2.00) 14.00 (3.00) 42.00 (5.00) Weekly work hours 30 to 40 hours 14.00 (2.00) .742 14.00 (3.00) .445 41.00 (6.00) .919 41 to 50 hours 15.00 (2.00) 14.00 (3.00) 42.00 (5.00) Above 50 hours 15.00 (3.00) 15.00 (3.00) 42.00 (5.00) Daily sedentary time Within 30 min 15.00 (2.00) .549 15.00 (2.00) .216 42.00 (5.00) .652 30 min to 2 hours 14.00 (3.00) 13.00 (4.00) 43.00 (5.00) 2 to 5 hours 15.00 (2.00) 14.00 (4.00) 42.00 (5.00) 5 to 8 hours 15.00 (2.00) 15.00 (3.00) 41.00 (5.00) Above 8 hours 15.00 (2.00) 14.50 (4.00) 41.00 (7.00) Work desk location Window seats with natural views 15.00 (3.00) .751 14.00 (3.00) .228 42.00 (5.00) .703 Window seats with urban views 16.00 (2.00) 14.00 (1.00) 42.00 (5.00) Aisle seats without window view 15.00 (2.00) 14.00 (3.00) 42.00 (5.00) Working years (in this company) 1 year or less 15.00 (2.00) .218 15.00 (3.00) .531 42.00 (5.00) .458 1-3 years 15.00 (3.00) 14.00 (4.00) 42.00 (7.00) 3-5 years 15.00 (3.00) 14.50 (3.00) 42.00 (6.00) Above 5 years 15.00 (2.00) 14.00 (3.00) 41.00 (6.00) Office location Singapore 15.00 (2.00) .995 14.00 (3.00) .701 41.00 (5.00) .244 Shenzhen, China 15.00 (3.00) 15.00 (3.00) 43.00 (5.00) *p<.05, The significance level is .05.
					0	3) Elaboration for the Figure 2.
					0	Stacked graph with percentage responses for individually arranged items (from the bottom with a high percentage of disagreement to the top with high percentage of agreement) is reduced, because the illustrations are obvious in the figure.
					0	Revision in Page 15-17 Line 399-433: The analysis of individual items provides more details into the works' responses.
					0	"As can be seen in percentage responses for individual items (Figure 2 in revision), most of the responses are distributed in the items ""Neutral"" and ""Agree""."
					0	The questionnaire results reveal that the employees from the understudy companies hold a relatively positive opinion on wellbeing, nature-relatedness, indoor environmental quality, and biophilic design for their health promotion.
					0	According to the arrangement, at the top of this, stacked graph are the evaluation of satisfaction of the work capacities and relationships in the workplace.
					0	About 73.2% of respondents agree that the workers of the companies under investigation are satisfied with their work capacity (GH3-Q10) and relationships (GH4-Q11).
					0	In the subscale nature relatedness, 62.2% and 61.7% of workers responded (agree/strongly agree) that their actions affect the environment (NR2-Q13), and they take notice of the wildlife in their daily lives (NR3-Q14).
					0	Nevertheless, only 47.8% of them selected agreed/strongly agree regarding the statements that their ideal spot for vacation would be a wilderness area (NR1-Q12).
					0	Regarding the POE results in the subscale BDE, 63.2% of workers agree/strongly agree that the natural light is an essential biophilic attribute and their offices are bright (BDE2-Q17).
					0	Furthermore, 60.7 % of the workers agreed that introducing natural colors in the office benefits workplace health and wellbeing (BDE11-Q26).
					0	More than 60 percent (approximately 60.7%) of respondents believe that greenery is a biophilic design that benefits office wellbeing (BDE6-Q21).
					0	Their feedback would be valuable for designers to note that application of the biophilic design attributes in the office design can enhance the experiences and evaluations of workers.
					0	The quantitative results of the questionnaire survey demonstrate that the workers agree that the biophilic design attributes in the office have positive effects on their subjective wellbeing.
					0	Figure 2.
					0	Stacked graph with percentage responses for individually arranged items (from the bottom with a high percentage of disagreement to the top with high percentage of agreement).
					0	Point 4: The result of biophilic design frameworks for specific workplace typology is of certain value.
					0	The location of the workplace selected in this article is limited, the related biophilic factors are scientifically screened, and the researchers have made a detailed classification study.
					0	However, the huge research scope has certain obstacles to the relevant results, and the general and targeted conclusions will be worse.
					0	Response 4: Thank you for your comments.
					0	These considerations are the limitations of this study.
					0	1) these two cases are limited in representing all the workplace biophilic designs.
					0	As mentioned in the Conclusion, in the future study, we will include more offices and locations as experiment samples.
					0	2) The investigative POE studies evaluated the self-reported health (GH), nature-relatedness (NR), and biophilic design in the workplace (BDE).
					0	The objective of the study is to evaluate the typical biophilic design attributes in office environment and the correlation between biophilic design and office health.
					0	Hence, the research scope is relatively extensive.
					0	In the future study, the research scope should be narrow down for intensive investigation.
					0	Point 5: It is best to supplement and describe the necessity of research.
					0	At the same time, it will be more complete if the results are reflected in the summary.
					0	Response 5: Thank you for your suggestion.
					0	The description of the necessity of research is highlight in the revised version.
					0	Please kindly refer the following revisions: Revision in Page 2 Line 56-66: “Although the importance of biophilic design seems to be well-acknowledged, and some international or regional green building and healthy building standards incorporate biophilic design elements into the rating system, such as WELL building standard version 2 and Singapore Green Mark [53].
					0	However, further research on developing building typology-based biophilic design guide-lines and assessment methods are necessary.
					0	Additionally, the effectiveness of such design in practical design projects for user wellbeing still requires confirmation.
					0	More importantly, building typology-based biophilic design guidelines should be appropriately developed because it would affect the designer's prioritization of design attributes selection in design practice.” Point 6: The object of the questionnaire should be composed of people with different ages and genders, which is best explained in the article.
					0	Response 6: The different genders and different ages are included in the study.
					0	The age ranges included 21-25, 26-35, 36-45, 46-60.
					0	The detailed description of the demographic information is in Section 3.1.
					0	Demographic Information.
					0	Point 7: Adding some explanations, examples and data comparison to the conclusion will be more intuitive and convincing, just as discussed earlier in the article.
					0	Perhaps this makes this article completer and more credible.
					0	At the same time, the conclusion only summarizes the article, and lacks discussions and explanations for the future research direction.
					0	Response 7: 1) The Conclusion is rewritten to highlight the relationship between biophilic design and occupant health and wellbeing: Revision in Page 23 Line 516-540: “The significant research outputs from the present scrutiny are shown as following: a) The authors develop a POE questionnaire for evaluating the biophilic design for workplace health and wellbeing.
					0	The investigation explains that combined literature review and POE results are one of the practical methodologies to establish biophilic design frameworks for specific workplace typology.
					0	And the questionnaire can be applied in future biophilic design research for investigation.
					0	b) Additionally, the study provides novel design guidelines for designers with emphasizing on weight for workplace design practices.
					0	The weighting results of this study would be especially applicable to the workplace typology.
					0	The 14 Patterns of Biophilic Design has a broader range of usage for all building typologies and is more suitable for general design applications.
					0	Therefore, the weighting results of this experiment are not employed to deny the ranking in the 14 Patterns of Biophilic Design.
					0	These are exploited to show a new biophilic design framework for the workplace according to the users’ points of view (based on the POE results).
					0	c) Furthermore, the questionnaire results enhance our knowledge on the practical ap-plication of biophilic design frameworks for the workplace and contributed to more framework design consideration.
					0	d) The correlation results support the importance of biophilic design from the user perspectives.
					0	There is a significant correlation between office biophilic design and self-reported health of employees (r=.270**, p < .01).
					0	e) The study results contribute to provide designers with evidence-based design at-tributes for workplace design (i.e., the nine selected workplace biophilic design attributes).” 2) The Conclusion is reconstructed and a separate section-- Section 6.
					0	Limitation and Future Studies is added in the revised version: Revision in Page 23 Line 542-551: “6.
					0	Limitation and Future Studies There are limitations in this study, first, these two cases are limited in representing all the workplace biophilic designs due to the sample size limitations.
					0	Further studies could include more offices and locations as experiment samples.
