side	opponent	round	number	attacks	ann	text
					0	Achieving this requires and involves a rebalancing of society and new imaginaries (as master signifiers), such as the well-being economy and a Natural Social Contract, as important new orientations.
					0	17 Reviewer 2: 4) Further problematize the discussions/debates that are being mobilized in the article.
					0	"The theoretical debates and the literature on ""social contract"", ""public governance"" and ""sustainability"" are vast and controversial."
					0	It is important that the authors also go into the challenges, the difficulties, the dilemmas in these debates.
					0	To mention just one aspect, the text makes little or no reference to the differences and nuances between the realities and contexts of the countries of the North and the South, nor to the relationship between sustainability and social inequalities or between sustainability and democracy.
					0	Only in these aspects it is possible to bring several elements that problematize the discussion and show that there is not a single path or model for building public governance that favors sustainability.
					0	We fully agree that there is not a single path or model for building public governance that favors sustainability.
					0	In this regard, we have stressed, on several occasions, that social contract formation takes place in polycentric ways at different levels (always context-specific and path-dependent).
					0	Challenges related to sustainability, social inequalities, or public governance, regardless of whether it takes place in the North or South, call for transformation-oriented forms of governance which are capable of dealing with complexity, ambiguity, and uncertainty.
					0	18 Reviewer 2: 5) In terms of the debate on public governance it would be important to insert the discussion of co-evolutionary governance not only ideally, but also exploring the differences between this theoretical proposition and other forms of governance already discussed in the literature as collaborative governance (Ansell and Gash, 2015), for example.
					0	Such an approach could help to better see the authors' contributions and the difference of this contribution to what has already been discussed about public governance, a debate that is nowadays quite robust.
					0	Section 2 on “Transformation pleas and approaches for achieving this” has been substantially revised and we discuss three models for working towards transitions: collaborative governance (including Ansell and Gash, 2015), evolutionary steering and adaptive governance.
					0	All three deal with complexity, normativity and uncertainty in an action-oriented way and have mechanisms of self-correction and adaptation which is necessary for transformations which cannot be planned and implemented from the top, but which must find solutions to demands for participation, fairness in outcomes, unintended effects in order to remain legitimate and secure continued support from societal stakeholders.
					0	For more information see section 2 on page 3-10.
					0	"19 Reviewer 2: 6) Empirical cases are very relevant, but are placed as ""mere examples"" without delving into the challenges and difficulties lived in practice."
					0	In this sense, it is not clear the relationship between the propositions presented by the authors in section 4 and the empirical or even theoretical evidences presented in the article.
					0	I suggest to improve the interface between the propositions presented and what comes before in the text.
					0	Our line of argumentation has been revised, and examples have been reduced to examples.
					0	Thanks to many changes our paper now provides a clear argumentation and logical structure, with the first part delving into literature to explain the key issues and concepts, and then moving to solutions.
					0	In addition, the line-up of the figures (no.
					0	2, 3 and 4 above) in our manuscript (with two new figures compared to the original manuscript) has deliberately been chosen in response to a number of comments from reviewers.
					0	The line-up moves from high abstraction level (figure 2), towards a tool for identifying options for co-evolutionary steering (figure 3), to an example of leverage points for a specific transition path (figure 4).
					0	20 Reviewer 3: The paper presents quite an interesting discussion.
					0	The case at local and regional levels are well developed, but the discussion at international level seems poor, maybe the authors could exclude this mentioned focus o the Introduction I'll suggest a format review in the figures and their quotations, as well as the box and the table.
					0	Format of figures and tables has been improved where appropriate.
					0	Cover letter to Journal ‘Sustainability’ Special Issue: Environmental Policy and Governance: Evolutionary Perspectives Subject: Minor revisions / point-to-point response to reviewers’ second round of response Date: 14 February 2022 Manuscript ID: sustainability-1512113 Manuscript title: Transition policy after corona: The importance of a Natural Social Contract and co-evolutionary governance No.
					0	Comment Response by authors 1 Reviewer 1: “This paper has much improved, also because its scope is clearer.
					0	I am still puzzled about the selection aspect of EGT, notably the specific roles of metaphors, open concepts and master signifiers play here (as objects and agents of selection) - particularly now NCS has been presented as a master signifier.
					0	But that may be for a later argument.
					0	Language is generally okay.
					0	"The argument could certainly be presented more succinctly, and there is a need for a light language wash (""with the?"
					0	"coevolution"", ""health care"", ""es"" etc....)”"
Author	Reviewer_1	4	2	2	1	We have taken out the statement that a NCS is a master signifier and rechecked the English.
					0	2 Reviewer 2: “
Reviewer_2	Author	3	1	0	2	The authors made a visible effort of revision, introducing new sections and discussing better the debates on which their arguments are based.
Reviewer_2	Author	3	1	0	2	I don't see a problem in a theoretical article to be normative, however some problems in the paper remain and it still need a revision to be published.
Reviewer_2	Author	3	1	0	2	Specially it needs better clarity in terms of focus and structure.
Reviewer_2	Author	3	1	0	2	Here are my recommendations:”
Author	Reviewer_2	4	3	1	1	We have improved the focus and structure in ways described below.
					0	3 Reviewer 2: “ 1)
Reviewer_2	Author	3	2	0	2	The text puts in relation 03 new notions that need to be better related by the authors: evolutionary/transformative governance, transformative socioecological innovation and natural social contract.
Reviewer_2	Author	3	2	0	2	These notions are proposed by the authors and based on their previous work (since they rely on self-citation).
Reviewer_2	Author	3	2	0	2	Therefore, it seems essential to me to make it clear in each of the sections of the article that deal with these notions from where they start and how they relate to previous debates to support the authors' arguments.
Reviewer_2	Author	3	2	0	2	It is also essential to make a better connection between these notions, since the relationship between them is not evident per se.”
Author	Reviewer_2	4	4	2	1	Governance approaches mentioned are now related to Transformative Social-Ecological Innovation (TSEI), which are innovations with explicit transformative goals and attention to mutual gains, and originating from political science and negotiation theory in particular.
Author	Reviewer_2	4	4	2	1	EGT gives attention to actor/institutions dialectics and power/knowledge dialectics, elements that have taken been into account in the TSEI-framework (figure 1) and related text.
					0	4 Reviewer 2: “ 2)
Reviewer_2	Author	3	3	0	2	In this sense, I recommend to start with the broader discussion of the natural contract (beggining of session 3), ending with the question of how to put in practice this social contract, what challenges (what is the main focus of this text).
Reviewer_2	Author	3	3	0	2	"The line 160 present this question as: ""The big question for steering is: how to initiate and accelerate system changes whose features are not perfectly clear and often times underdeveloped compared to the existing systems?"
Reviewer_2	Author	3	3	0	2	This would make room to bring session 02 that addresses evolutionary/transformative governance to the TSEI.”
Author	Reviewer_2	4	5	3	1	Our build-up of argumentation has been improved.
					0	5 Reviewer 2: “ 2)
Reviewer_2	Author	3	4	0	2	"The section 02 ""Transformation pleas and approach to achieve this"" can be improved."
Reviewer_2	Author	3	4	0	2	"I recommend reviewing the title referring to the governance debate that is addressed in the section, for example: ""Transformative pleas and approaches of governance to achieve this""...It is also important to better relate/ differentiate the evolutionary governance proposed by authors and the others discussed in the literature (adaptive, reflexive, deliberative, collaborative, etc.)."
Reviewer_2	Author	3	4	0	2	The authors cite several debates/definitions/approaches, but do not position themselves in relation to them, making clear what their theoretical contribution.
Reviewer_2	Author	3	4	0	2	I suggest that the authors present the debate and the different definitions and then present the notion of GE, relating it to the TSEI.”
Author	Reviewer_2	4	6	4	1	Changes have been made accordingly.
Author	Reviewer_2	4	6	4	1	See section with new title: “Transformation pleas and governance approaches for achieving this”.
Author	Reviewer_2	4	6	4	1	The section now better relates/differentiates evolutionary governance from the other governance approaches mentioned.
Author	Reviewer_2	4	6	4	1	EGT understands governance as radically evolutionary and is mindful of limitations of any form of governance.
					0	13 Reviewer 2: 3)
Reviewer_2	Author	3	5	0	2	The examples placed in section 03 could compose a section in itself, which sought to relate theory and practical examples (not cases), illustrating the proposed model.
Reviewer_2	Author	3	5	0	2	It will be nice to put forward the discussion of the conceptual variables of transformative governance proposed.
Author	Reviewer_2	4	7	5	1	Practical examples in this section are now more explicit on co-evolutionary steering and multiple value creation insights.
Author	Reviewer_2	4	7	5	1	Social contract theory helps to recognize duties and rights of citizens and consider issues of rebalancing society, and approaches and mechanisms for achieving this.
					0	14 Reviewer 2: 4)
Reviewer_2	Author	3	6	0	2	It remains not clear the relationship between the propositions presented by the authors in section 4 and the discutions in other sections.
Reviewer_2	Author	3	6	0	2	I suggest to improve the interface between the propositions presented and what comes before in the text, specialy linking with the contributions and limites of the proposal to face this challenges.
Author	Reviewer_2	4	8	6	1	This comment is not entirely clear to us.
Author	Reviewer_2	4	8	6	1	The four proposals for transition policy in section 4 are based on co-evolutionary governance and related discussions in previous sections.
					0	15 Reviewer 2: 5)
Reviewer_2	Author	3	7	0	2	Formal aspects: The text needs a language revision and formatting of the figures to make them more readable.
Reviewer_2	Author	3	7	0	2	Avoid the excessive use of acronyms and review them throughout the text.
Reviewer_2	Author	3	7	0	2	I thank the authors and the editor for this opportunity to review and discuss this interesting paper and I hope that my comments help to improve the paper.
Reviewer_2	Author	3	7	0	2	Best regards.
Author	Reviewer_2	4	9	7	1	Language and figures have been improved.
					0	Cover letter to Journal ‘Sustainability’ Special Issue: Environmental Policy and Governance: Evolutionary Perspectives Subject: Minor revisions / point-to-point response to reviewers’ second round of response Date: 14 February 2022 Manuscript ID: sustainability-1512113 Manuscript title: Transition policy after corona: The importance of a Natural Social Contract and co-evolutionary governance No.
					0	Comment Response by authors 1 Reviewer 1: “This paper has much improved, also because its scope is clearer.
					0	I am still puzzled about the selection aspect of EGT, notably the specific roles of metaphors, open concepts and master signifiers play here (as objects and agents of selection) - particularly now NCS has been presented as a master signifier.
					0	But that may be for a later argument.
					0	Language is generally okay.
					0	"The argument could certainly be presented more succinctly, and there is a need for a light language wash (""with the?"
					0	"coevolution"", ""health care"", ""es"" etc....)” We have taken out the statement that a NCS is a master signifier and rechecked the English."
					0	2 Reviewer 2: “The authors made a visible effort of revision, introducing new sections and discussing better the debates on which their arguments are based.
					0	I don't see a problem in a theoretical article to be normative, however some problems in the paper remain and it still need a revision to be published.
					0	Specially it needs better clarity in terms of focus and structure.
					0	Here are my recommendations:” We have improved the focus and structure in ways described below.
					0	3 Reviewer 2: “1) The text puts in relation 03 new notions that need to be better related by the authors: evolutionary/transformative governance, transformative socioecological innovation and natural social contract.
					0	These notions are proposed by the authors and based on their previous work (since they rely on self-citation).
					0	Therefore, it seems essential to me to make it clear in each of the sections of the article that deal with these notions from where they start and how they relate to previous debates to support the authors' arguments.
					0	It is also essential to make a better connection between these notions, since the relationship between them is not evident per se.” Governance approaches mentioned are now related to Transformative Social-Ecological Innovation (TSEI), which are innovations with explicit transformative goals and attention to mutual gains, and originating from political science and negotiation theory in particular.
					0	EGT gives attention to actor/institutions dialectics and power/knowledge dialectics, elements that have taken been into account in the TSEI-framework (figure 1) and related text.
					0	4 Reviewer 2: “2) In this sense, I recommend to start with the broader discussion of the natural contract (beggining of session 3), ending with the question of how to put in practice this social contract, what challenges (what is the main focus of this text).
					0	"The line 160 present this question as: ""The big question for steering is: how to initiate and accelerate system changes whose features are not perfectly clear and often times underdeveloped compared to the existing systems?"
					0	This would make room to bring session 02 that addresses evolutionary/transformative governance to the TSEI.” Our build-up of argumentation has been improved.
					0	"5 Reviewer 2: “2) The section 02 ""Transformation pleas and approach to achieve this"" can be improved."
					0	"I recommend reviewing the title referring to the governance debate that is addressed in the section, for example: ""Transformative pleas and approaches of governance to achieve this""...It is also important to better relate/ differentiate the evolutionary governance proposed by authors and the others discussed in the literature (adaptive, reflexive, deliberative, collaborative, etc.)."
					0	The authors cite several debates/definitions/approaches, but do not position themselves in relation to them, making clear what their theoretical contribution.
					0	I suggest that the authors present the debate and the different definitions and then present the notion of GE, relating it to the TSEI.” Changes have been made accordingly.
					0	See section with new title: “Transformation pleas and governance approaches for achieving this”.
					0	The section now better relates/differentiates evolutionary governance from the other governance approaches mentioned.
					0	EGT understands governance as radically evolutionary and is mindful of limitations of any form of governance.
					0	13 Reviewer 2: 3) The examples placed in section 03 could compose a section in itself, which sought to relate theory and practical examples (not cases), illustrating the proposed model.
					0	It will be nice to put forward the discussion of the conceptual variables of transformative governance proposed.
					0	Practical examples in this section are now more explicit on co-evolutionary steering and multiple value creation insights.
					0	Social contract theory helps to recognize duties and rights of citizens and consider issues of rebalancing society, and approaches and mechanisms for achieving this.
					0	14 Reviewer 2: 4) It remains not clear the relationship between the propositions presented by the authors in section 4 and the discutions in other sections.
					0	I suggest to improve the interface between the propositions presented and what comes before in the text, specialy linking with the contributions and limites of the proposal to face this challenges.
					0	This comment is not entirely clear to us.
					0	The four proposals for transition policy in section 4 are based on co-evolutionary governance and related discussions in previous sections.
					0	15 Reviewer 2: 5) Formal aspects: The text needs a language revision and formatting of the figures to make them more readable.
					0	Avoid the excessive use of acronyms and review them throughout the text.
					0	I thank the authors and the editor for this opportunity to review and discuss this interesting paper and I hope that my comments help to improve the paper.
					0	Best regards.
					0	Language and figures have been improved.
